{
  "meta": {
    "entrevista_id": "2026-07-23_comercial-administracion-vehicular",
    "rol_area": "Comercial — administración vehicular y cargadores eléctricos",
    "fecha": "2026-07-23",
    "duracion_minutos": 41,
    "anonimizado": true
  },
  "workflows": [
    {
      "proceso": "Prospección y cierre comercial con concesionarias",
      "disparador": "Visita directa a la concesionaria",
      "frecuencia": "continua",
      "dueño_de_facto": "Comercial",
      "pasos": [
        {
          "orden": 1,
          "actor": "Comercial",
          "accion": "Presenta a DPROMA, tiempo de experiencia y garantías de servicio",
          "herramienta_o_canal": "Visita presencial",
          "evidencia_timestamp": "00:09:11",
          "unclear": false
        },
        {
          "orden": 2,
          "actor": "Comercial",
          "accion": "Da seguimiento informal a comentarios y cotizaciones sin registro estructurado",
          "herramienta_o_canal": "WhatsApp / memoria",
          "evidencia_timestamp": "00:27:20",
          "unclear": true
        }
      ]
    }
  ],
  "pain_points": [
    {
      "id": "pp-008",
      "categorias": [
        "falta_centralizacion",
        "falta_formatos_comunes"
      ],
      "descripcion": "No existe una herramienta de gestión de relaciones con clientes para registrar seguimiento e historial de más de 20 clientes activos.",
      "severidad": "alta",
      "evidencia": "Enfatiza la urgencia de una herramienta similar a HubSpot para registrar comentarios, seguimientos e historial",
      "evidencia_timestamp": "00:27:20",
      "roles_afectados": [
        "comercial",
        "operaciones"
      ]
    },
    {
      "id": "pp-009",
      "categorias": [
        "gestion_por_whatsapp",
        "falta_centralizacion"
      ],
      "descripcion": "El mercado de gestoría vehicular es informal (comisiones paralelas a vendedores); DPROMA compite ofreciendo procesos formales pero sin sistema que lo respalde aún.",
      "severidad": "media",
      "evidencia": "Cerca del 80% de los vendedores de agencias realiza trámites de gestoría por fuera de la empresa para obtener comisiones",
      "evidencia_timestamp": "00:07:00",
      "roles_afectados": [
        "comercial"
      ]
    }
  ],
  "tools_inventory": [
    {
      "herramienta": "WhatsApp",
      "tipo": "digital_no_ia",
      "contexto_de_uso": "comunicación con concesionarias y seguimiento comercial",
      "nivel_adopcion": "avanzada",
      "origen": "organizacional",
      "evidencia_timestamp": "00:34:33"
    },
    {
      "herramienta": "Excel (enviado por correo)",
      "tipo": "digital_no_ia",
      "contexto_de_uso": "seguimiento comercial sin trabajo colaborativo en tiempo real",
      "nivel_adopcion": "basica",
      "origen": "personal_informal",
      "evidencia_timestamp": "00:36:13"
    }
  ],
  "ai_adoption": {
    "nivel_uso_actual": "basico",
    "casos_de_uso": [],
    "barreras": [
      "recibió información falsa sobre datos de agencias en una experiencia previa"
    ],
    "actitud": "cauteloso",
    "evidencia_timestamp": "00:38:20"
  },
  "opportunities": [
    {
      "id": "op-007",
      "titulo": "Módulo CRM comercial con historial de clientes",
      "descripcion": "Priorizar el módulo de CRM comercial para registrar seguimiento e historial de las concesionarias activas, hoy sostenido en memoria y WhatsApp.",
      "pain_points_relacionados": [
        "pp-008"
      ],
      "objetivo_dproma_relacionado": [
        1
      ],
      "impacto": "alto",
      "esfuerzo": "medio"
    },
    {
      "id": "op-008",
      "titulo": "Migrar seguimiento de Excel por correo a hoja colaborativa",
      "descripcion": "Sustituir el envío de Excel por correo por una hoja de cálculo colaborativa en tiempo real, como paso intermedio antes del CRM completo.",
      "pain_points_relacionados": [
        "pp-009"
      ],
      "objetivo_dproma_relacionado": [
        4
      ],
      "impacto": "medio",
      "esfuerzo": "bajo"
    }
  ],
  "narrative": {
    "persona_arquetipo": "quien sostiene la relación comercial con las agencias automotrices",
    "vinetas": [
      {
        "texto": "El argumento de venta es la formalidad: garantías de tiempo, procesos claros, frente a un mercado donde buena parte de los trámites se resuelven por fuera con comisiones informales. La ironía es que ese seguimiento comercial tan formal en el discurso hoy vive en la memoria y en hilos de WhatsApp, sin un solo lugar donde consultar el historial de un cliente.",
        "pain_points_relacionados": [
          "pp-008"
        ],
        "anonymization_check": "passed"
      }
    ]
  }
}
