{
  "meta": {
    "entrevista_id": "2026-07-16_soporte-administrativo-transversal",
    "rol_area": "Seguimiento del proceso con proveedor tecnológico / soporte administrativo transversal",
    "fecha": "2026-07-16",
    "duracion_minutos": 68,
    "anonimizado": true
  },
  "workflows": [
    {
      "proceso": "Alta de cliente (agencia automotriz) en el padrón",
      "disparador": "Ventas abre un grupo de WhatsApp con la agencia",
      "frecuencia": "por cliente/agencia nuevo",
      "dueño_de_facto": "Soporte administrativo transversal",
      "pasos": [
        {
          "orden": 1,
          "actor": "Ventas",
          "accion": "Abre grupo de WhatsApp con la agencia",
          "herramienta_o_canal": "WhatsApp",
          "evidencia_timestamp": "00:18:35",
          "unclear": false
        },
        {
          "orden": 2,
          "actor": "Soporte administrativo",
          "accion": "Solicita constancia fiscal, comprobante de domicilio y carátula bancaria",
          "herramienta_o_canal": "WhatsApp",
          "evidencia_timestamp": "00:17:30",
          "unclear": false
        },
        {
          "orden": 3,
          "actor": "Agencia",
          "accion": "Envía documentos por correo tras la solicitud en WhatsApp",
          "herramienta_o_canal": "Correo electrónico",
          "evidencia_timestamp": "00:21:23",
          "unclear": false
        },
        {
          "orden": 4,
          "actor": "Soporte administrativo",
          "accion": "Captura y organiza manualmente los datos en un Excel propio",
          "herramienta_o_canal": "Excel",
          "evidencia_timestamp": "00:22:44",
          "unclear": false
        },
        {
          "orden": 5,
          "actor": "Soporte administrativo",
          "accion": "Confirma alta al cliente y notifica a facturación e instaladores",
          "herramienta_o_canal": "WhatsApp / correo",
          "evidencia_timestamp": "00:22:44",
          "unclear": false
        }
      ]
    },
    {
      "proceso": "Compra de uniformes y EPP para nuevos instaladores",
      "disparador": "Área correspondiente notifica contratación de nuevo instalador",
      "frecuencia": "por contratación",
      "dueño_de_facto": "Soporte administrativo transversal",
      "pasos": [
        {
          "orden": 1,
          "actor": "Área solicitante",
          "accion": "Informa tallas requeridas",
          "herramienta_o_canal": "Correo/WhatsApp",
          "evidencia_timestamp": "00:33:26",
          "unclear": true
        },
        {
          "orden": 2,
          "actor": "Soporte administrativo",
          "accion": "Solicita cotización a proveedores con correo corporativo verificado",
          "herramienta_o_canal": "Correo electrónico",
          "evidencia_timestamp": "00:34:49",
          "unclear": false
        },
        {
          "orden": 3,
          "actor": "Soporte administrativo",
          "accion": "Envía cotización a Dirección General para autorización",
          "herramienta_o_canal": "WhatsApp",
          "evidencia_timestamp": "00:33:26",
          "unclear": false
        },
        {
          "orden": 4,
          "actor": "Compras",
          "accion": "Procesa el pago tras aprobación",
          "herramienta_o_canal": "Transferencia bancaria",
          "evidencia_timestamp": "00:36:12",
          "unclear": false
        }
      ]
    }
  ],
  "pain_points": [
    {
      "id": "pp-001",
      "categorias": [
        "gestion_por_whatsapp",
        "trabajo_manual",
        "falta_centralizacion"
      ],
      "descripcion": "El alta de clientes depende de solicitudes por WhatsApp y captura manual en Excel personal, sin formularios digitales de captura directa.",
      "severidad": "alta",
      "evidencia": "Debe recopilar y organizar manualmente toda la información en un archivo Excel propio antes de confirmar el alta",
      "evidencia_timestamp": "00:22:44",
      "roles_afectados": [
        "soporte administrativo",
        "facturación",
        "instalaciones"
      ]
    },
    {
      "id": "pp-002",
      "categorias": [
        "falta_centralizacion",
        "falta_formatos_comunes"
      ],
      "descripcion": "No existe repositorio centralizado de contratos comerciales; cada área los guarda localmente, provocando cobros inconsistentes con lo pactado.",
      "severidad": "alta",
      "evidencia": "Genera cobros inconsistentes con los precios pactados, reclamos de clientes y riesgo de penalizaciones",
      "evidencia_timestamp": "00:51:11",
      "roles_afectados": [
        "jurídico",
        "facturación",
        "cobranza",
        "instalaciones"
      ]
    },
    {
      "id": "pp-003",
      "categorias": [
        "gestion_por_whatsapp",
        "falta_visibilidad_kpis"
      ],
      "descripcion": "Una campaña de marketing sin infraestructura humana suficiente para atender los leads generó pérdida masiva de prospectos por WhatsApp.",
      "severidad": "alta",
      "evidencia": "Más de 200 mensajes recibidos, prácticamente el 100% de los leads se perdieron por falta de personal asignado",
      "evidencia_timestamp": "01:02:45",
      "roles_afectados": [
        "ventas",
        "marketing"
      ]
    }
  ],
  "tools_inventory": [
    {
      "herramienta": "Excel",
      "tipo": "digital_no_ia",
      "contexto_de_uso": "captura manual de altas de cliente y control de inventario de EPP",
      "nivel_adopcion": "intermedia",
      "origen": "personal_informal",
      "evidencia_timestamp": "00:41:27"
    },
    {
      "herramienta": "WhatsApp",
      "tipo": "digital_no_ia",
      "contexto_de_uso": "solicitud de documentos a agencias y coordinación de aprobaciones internas",
      "nivel_adopcion": "avanzada",
      "origen": "organizacional",
      "evidencia_timestamp": "00:18:35"
    },
    {
      "herramienta": "Correo electrónico",
      "tipo": "digital_no_ia",
      "contexto_de_uso": "recepción de documentos fiscales y cotizaciones formales de proveedores",
      "nivel_adopcion": "intermedia",
      "origen": "organizacional",
      "evidencia_timestamp": "00:21:23"
    }
  ],
  "ai_adoption": {
    "nivel_uso_actual": "ninguno",
    "casos_de_uso": [],
    "barreras": [],
    "actitud": "cauteloso",
    "evidencia_timestamp": "00:03:23"
  },
  "opportunities": [
    {
      "id": "op-001",
      "titulo": "Formulario digital de alta de cliente",
      "descripcion": "Sustituir la solicitud de documentos por WhatsApp y captura manual en Excel por un formulario digital conectado al padrón del CRM.",
      "pain_points_relacionados": [
        "pp-001"
      ],
      "objetivo_dproma_relacionado": [
        1,
        4
      ],
      "impacto": "alto",
      "esfuerzo": "medio"
    },
    {
      "id": "op-002",
      "titulo": "Repositorio único de contratos con custodia jurídica",
      "descripcion": "Jurídico como único custodio del repositorio de contratos, con permisos diferenciados de edición/consulta por área.",
      "pain_points_relacionados": [
        "pp-002"
      ],
      "objetivo_dproma_relacionado": [
        1,
        4
      ],
      "impacto": "alto",
      "esfuerzo": "medio"
    },
    {
      "id": "op-003",
      "titulo": "Checklist de capacidad operativa antes de lanzar campañas",
      "descripcion": "Validar personal y flujo de atención de leads antes de lanzar campañas de marketing, para no repetir la pérdida de prospectos.",
      "pain_points_relacionados": [
        "pp-003"
      ],
      "objetivo_dproma_relacionado": [
        2
      ],
      "impacto": "medio",
      "esfuerzo": "bajo"
    }
  ],
  "narrative": {
    "persona_arquetipo": "quien sostiene el alta de clientes y la relación administrativa con las agencias",
    "vinetas": [
      {
        "texto": "Cada agencia nueva llega por un grupo de WhatsApp. De ahí salen los documentos fiscales, el comprobante de domicilio, la carátula bancaria — y todo termina capturado a mano en un Excel personal antes de poder confirmarle el alta a nadie. No hay un formulario, hay una persona sosteniendo el proceso con paciencia y una hoja de cálculo.",
        "pain_points_relacionados": [
          "pp-001"
        ],
        "anonymization_check": "passed"
      },
      {
        "texto": "Una campaña de redes sociales funcionó mejor de lo esperado: más de 200 mensajes de WhatsApp en pocos días. El problema no fue conseguir el interés, fue no tener a nadie disponible para responder — casi todos esos contactos se perdieron.",
        "pain_points_relacionados": [
          "pp-003"
        ],
        "anonymization_check": "passed"
      }
    ]
  }
}
